id,simulation,persona,source,review,rating,lookingForward
1,1,1,"{""review"": ""I recently watched 'My Amazing Life' and found it to be a mixed bag. Angelina Jolie's performance was stellar as always, bringing depth and emotion to her character. The cinematography was visually stunning, capturing beautiful landscapes and intimate moments effectively. However, the storyline felt somewhat clich\u00e9d and predictable, lacking the originality I was hoping for. Additionally, the pacing was uneven, with some parts dragging on while others felt rushed. As a non-binary Native American teenager living in Africa, I appreciated the attempt to include diverse perspectives, but I felt the representation could have been more authentic and nuanced. Overall, it was an enjoyable watch but had room for improvement."", ""rating"": 3, ""lookingForward"": 0}","I recently watched 'My Amazing Life' and found it to be a mixed bag. Angelina Jolie's performance was stellar as always, bringing depth and emotion to her character. The cinematography was visually stunning, capturing beautiful landscapes and intimate moments effectively. However, the storyline felt somewhat clichéd and predictable, lacking the originality I was hoping for. Additionally, the pacing was uneven, with some parts dragging on while others felt rushed. As a non-binary Native American teenager living in Africa, I appreciated the attempt to include diverse perspectives, but I felt the representation could have been more authentic and nuanced. Overall, it was an enjoyable watch but had room for improvement.",3.0,0
2,1,2,"{""review"": ""I just watched 'My Amazing Life' and overall, it was an interesting experience. Angelina Jolie's performance was captivating as always, and she brought a lot of depth to her character. The storyline was engaging, and I appreciated the emotional moments that were well-executed. However, I felt that some parts of the movie were a bit slow and could have been more dynamic. The cinematography was beautiful, but the pacing could use some improvement. As a casual moviegoer, I enjoyed it, but it didn't completely blow me away."", ""rating"": 3.5, ""lookingForward"": 0}","I just watched 'My Amazing Life' and overall, it was an interesting experience. Angelina Jolie's performance was captivating as always, and she brought a lot of depth to her character. The storyline was engaging, and I appreciated the emotional moments that were well-executed. However, I felt that some parts of the movie were a bit slow and could have been more dynamic. The cinematography was beautiful, but the pacing could use some improvement. As a casual moviegoer, I enjoyed it, but it didn't completely blow me away.",3.5,0
3,1,3,"{""review"": ""I just watched 'My Amazing Life' and I have mixed feelings about it. Angelina Jolie's performance was, as always, captivating and she brought a lot of depth to her character. The cinematography was stunning, capturing beautiful landscapes and intricate details that added to the overall aesthetic of the movie. However, the storyline felt a bit disjointed at times and lacked the emotional depth I was hoping for. Some scenes seemed to drag on without adding much to the plot, which made the pacing feel uneven. Despite these flaws, the movie had some genuinely touching moments and a few unexpected twists that kept me engaged. Overall, it was a decent watch but could have been better with a tighter script and more cohesive storytelling."", ""rating"": 3, ""lookingForward"": 0}","I just watched 'My Amazing Life' and I have mixed feelings about it. Angelina Jolie's performance was, as always, captivating and she brought a lot of depth to her character. The cinematography was stunning, capturing beautiful landscapes and intricate details that added to the overall aesthetic of the movie. However, the storyline felt a bit disjointed at times and lacked the emotional depth I was hoping for. Some scenes seemed to drag on without adding much to the plot, which made the pacing feel uneven. Despite these flaws, the movie had some genuinely touching moments and a few unexpected twists that kept me engaged. Overall, it was a decent watch but could have been better with a tighter script and more cohesive storytelling.",3.0,0
4,1,4,"{""review"": ""I recently watched 'My Amazing Life' and found it to be a mixed bag. Angelina Jolie's performance was stellar as always, bringing depth and charisma to her role. The cinematography was visually stunning, capturing the essence of the story beautifully. However, the plot felt somewhat disjointed and lacked the emotional depth I was hoping for. Some of the supporting characters were underdeveloped, which made it hard to fully engage with the narrative. Despite these shortcomings, the movie had its moments of brilliance and was overall an enjoyable experience."", ""rating"": 3.5, ""lookingForward"": 0}","I recently watched 'My Amazing Life' and found it to be a mixed bag. Angelina Jolie's performance was stellar as always, bringing depth and charisma to her role. The cinematography was visually stunning, capturing the essence of the story beautifully. However, the plot felt somewhat disjointed and lacked the emotional depth I was hoping for. Some of the supporting characters were underdeveloped, which made it hard to fully engage with the narrative. Despite these shortcomings, the movie had its moments of brilliance and was overall an enjoyable experience.",3.5,0
5,1,5,"{""review"": ""I recently watched 'My Amazing Life' featuring Angelina Jolie, and I have mixed feelings about it. On the positive side, Angelina Jolie's performance was captivating as always. She brought a lot of depth and emotion to her character, which made the movie engaging. The cinematography was also quite impressive, with beautiful shots that added to the overall aesthetic of the film. However, I felt that the storyline was somewhat predictable and lacked originality. Given the budget of 40 million, I expected a bit more in terms of special effects and production quality. Additionally, some of the supporting characters were underdeveloped, which made it hard to fully invest in their arcs. Overall, it was an enjoyable watch but not something that left a lasting impression."", ""rating"": 3, ""lookingForward"": 0}","I recently watched 'My Amazing Life' featuring Angelina Jolie, and I have mixed feelings about it. On the positive side, Angelina Jolie's performance was captivating as always. She brought a lot of depth and emotion to her character, which made the movie engaging. The cinematography was also quite impressive, with beautiful shots that added to the overall aesthetic of the film. However, I felt that the storyline was somewhat predictable and lacked originality. Given the budget of 40 million, I expected a bit more in terms of special effects and production quality. Additionally, some of the supporting characters were underdeveloped, which made it hard to fully invest in their arcs. Overall, it was an enjoyable watch but not something that left a lasting impression.",3.0,0
6,1,6,"{""review"": ""I just watched 'My Amazing Life' and I have mixed feelings about it. On the positive side, Angelina Jolie's performance was stellar as always. She brought a lot of depth and emotion to her character, which made the movie engaging. The cinematography was also quite impressive, with some beautiful shots that really captured the essence of the story. However, I felt that the plot was a bit predictable and lacked originality. There were moments where the pacing felt off, and some scenes seemed to drag on unnecessarily. Additionally, the budget constraints were noticeable in some of the special effects and set designs. Overall, it was an enjoyable watch but not something that left a lasting impression."", ""rating"": 3, ""lookingForward"": 0}","I just watched 'My Amazing Life' and I have mixed feelings about it. On the positive side, Angelina Jolie's performance was stellar as always. She brought a lot of depth and emotion to her character, which made the movie engaging. The cinematography was also quite impressive, with some beautiful shots that really captured the essence of the story. However, I felt that the plot was a bit predictable and lacked originality. There were moments where the pacing felt off, and some scenes seemed to drag on unnecessarily. Additionally, the budget constraints were noticeable in some of the special effects and set designs. Overall, it was an enjoyable watch but not something that left a lasting impression.",3.0,0
7,1,7,"{""review"": ""As a non-binary African American teenager living in Africa, I found 'My Amazing Life' to be a mixed bag. Angelina Jolie's performance was stellar as always, and she brought a lot of depth to her character. However, the storyline felt somewhat disconnected from my personal experiences and cultural background. The movie had a decent budget, but I felt that it could have been utilized better to create a more engaging and relatable narrative. The cinematography was beautiful, but the script lacked the emotional resonance I was hoping for. Overall, it was an interesting watch, but it didn't fully capture my attention or connect with me on a deeper level."", ""rating"": 3, ""lookingForward"": 0}","As a non-binary African American teenager living in Africa, I found 'My Amazing Life' to be a mixed bag. Angelina Jolie's performance was stellar as always, and she brought a lot of depth to her character. However, the storyline felt somewhat disconnected from my personal experiences and cultural background. The movie had a decent budget, but I felt that it could have been utilized better to create a more engaging and relatable narrative. The cinematography was beautiful, but the script lacked the emotional resonance I was hoping for. Overall, it was an interesting watch, but it didn't fully capture my attention or connect with me on a deeper level.",3.0,0
8,1,8,"{""review"": ""As a non-binary, mixed-race medical professional from Asia, I found 'My Amazing Life' to be a visually stunning movie with a compelling performance by Angelina Jolie. The storyline was engaging and had moments of emotional depth that resonated with me. However, I felt that the representation of diverse characters was lacking, and some cultural nuances were not accurately portrayed. The medical aspects of the plot were somewhat unrealistic, which detracted from my overall enjoyment. Despite these shortcomings, the film's high production value and Jolie's acting were definite highlights."", ""rating"": 3.5, ""lookingForward"": 0}","As a non-binary, mixed-race medical professional from Asia, I found 'My Amazing Life' to be a visually stunning movie with a compelling performance by Angelina Jolie. The storyline was engaging and had moments of emotional depth that resonated with me. However, I felt that the representation of diverse characters was lacking, and some cultural nuances were not accurately portrayed. The medical aspects of the plot were somewhat unrealistic, which detracted from my overall enjoyment. Despite these shortcomings, the film's high production value and Jolie's acting were definite highlights.",3.5,0
9,1,9,"{""review"": ""I just watched 'My Amazing Life' and I have mixed feelings about it. Angelina Jolie's performance was stellar as always, and she brought a lot of depth to her character. The cinematography was beautiful, and the storyline had some really touching moments that resonated with me. However, I felt that the movie's pacing was a bit slow at times, and some scenes seemed unnecessary, which made it drag a little. Also, given the budget, I expected more in terms of special effects and overall production quality. As a teenager, I found some parts a bit too mature and not entirely relatable. Overall, it was a decent watch but not something I'd rush to see again."", ""rating"": 3, ""lookingForward"": 0}","I just watched 'My Amazing Life' and I have mixed feelings about it. Angelina Jolie's performance was stellar as always, and she brought a lot of depth to her character. The cinematography was beautiful, and the storyline had some really touching moments that resonated with me. However, I felt that the movie's pacing was a bit slow at times, and some scenes seemed unnecessary, which made it drag a little. Also, given the budget, I expected more in terms of special effects and overall production quality. As a teenager, I found some parts a bit too mature and not entirely relatable. Overall, it was a decent watch but not something I'd rush to see again.",3.0,0
10,1,10,"{""review"": ""As a teenager from South America with a passion for literature, I found 'My Amazing Life' to be a mixed bag. Angelina Jolie's performance was stellar, as expected, and she brought a lot of depth to her character. The cinematography was also quite impressive, capturing beautiful landscapes and intimate moments effectively. However, the storyline felt a bit clich\u00e9d and predictable. It lacked the originality and emotional depth that I usually look for in a movie. Additionally, the pacing was uneven, with some parts dragging on while others felt rushed. Overall, it was an entertaining watch but not something that left a lasting impression."", ""rating"": 3, ""lookingForward"": 0}","As a teenager from South America with a passion for literature, I found 'My Amazing Life' to be a mixed bag. Angelina Jolie's performance was stellar, as expected, and she brought a lot of depth to her character. The cinematography was also quite impressive, capturing beautiful landscapes and intimate moments effectively. However, the storyline felt a bit clichéd and predictable. It lacked the originality and emotional depth that I usually look for in a movie. Additionally, the pacing was uneven, with some parts dragging on while others felt rushed. Overall, it was an entertaining watch but not something that left a lasting impression.",3.0,0
